{
  "schemaVersion": 1,
  "familyContract": "reflaxe.family.std.portable_allowlist",
  "contractVersion": "1.0.0",
  "name": "ocaml_portable_stdlib_allowlist",
  "target": "ocaml",
  "haxeVersion": "4.3.7",
  "baselineRef": "docs/00-project/STDLIB_PORTABLE_BASELINE_HAXE_4_3_7.json",
  "schemaRef": "docs/00-project/STDLIB_PORTABLE_ALLOWLIST_SCHEMA_V1.json",
  "tiers": {
    "tier1": [
      "Array",
      "EReg",
      "Math",
      "Reflect",
      "String",
      "StringBuf",
      "Sys",
      "Type",
      "haxe.Int32",
      "haxe.Int64",
      "haxe.Int64Helper",
      "haxe.ds.IntMap",
      "haxe.ds.Map",
      "haxe.ds.ObjectMap",
      "haxe.ds.StringMap",
      "haxe.io.Bytes",
      "haxe.io.BytesBuffer",
      "haxe.io.BytesData",
      "haxe.io.FPHelper",
      "haxe.io.Input",
      "haxe.io.Output",
      "haxe.io.Path",
      "sys.FileStat",
      "sys.FileSystem",
      "sys.io.File",
      "sys.io.FileInput",
      "sys.io.FileOutput",
      "sys.io.FileSeek",
      "sys.io.Process"
    ],
    "tier2": [
      "Array",
      "Date",
      "DateTools",
      "EReg",
      "List",
      "Map",
      "Math",
      "Reflect",
      "Std",
      "String",
      "StringBuf",
      "StringTools",
      "Sys",
      "Type",
      "haxe.CallStack",
      "haxe.DynamicAccess",
      "haxe.EnumTools",
      "haxe.Exception",
      "haxe.Int32",
      "haxe.Int64",
      "haxe.Int64Helper",
      "haxe.Json",
      "haxe.Log",
      "haxe.Resource",
      "haxe.Serializer",
      "haxe.Timer",
      "haxe.Unserializer",
      "haxe.ValueException",
      "haxe.ds.ArraySort",
      "haxe.ds.BalancedTree",
      "haxe.ds.Either",
      "haxe.ds.EnumValueMap",
      "haxe.ds.GenericStack",
      "haxe.ds.HashMap",
      "haxe.ds.IntMap",
      "haxe.ds.List",
      "haxe.ds.ListSort",
      "haxe.ds.Map",
      "haxe.ds.ObjectMap",
      "haxe.ds.Option",
      "haxe.ds.ReadOnlyArray",
      "haxe.ds.StringMap",
      "haxe.ds.Vector",
      "haxe.ds.WeakMap",
      "haxe.io.Bytes",
      "haxe.io.BytesBuffer",
      "haxe.io.BytesData",
      "haxe.io.BytesInput",
      "haxe.io.BytesOutput",
      "haxe.io.Eof",
      "haxe.io.Error",
      "haxe.io.FPHelper",
      "haxe.io.Input",
      "haxe.io.Output",
      "haxe.io.Path",
      "haxe.io.StringInput",
      "sys.FileStat",
      "sys.FileSystem",
      "sys.io.File",
      "sys.io.FileInput",
      "sys.io.FileOutput",
      "sys.io.FileSeek",
      "sys.io.Process",
      "sys.net.Host",
      "sys.net.Socket"
    ]
  }
}
